product_id,sku,name,url,price,list_price,original_price,rating_average,review_count,thumbnail_url,inventory_status,color,size,gender,category
127050110,6678179553083,"Quần Short Nam Thể Thao Đi Biển DESMIIT S732 - Họa Tiết Đặc Sắc, Thiết Kế Năng Động Với Dây Rút Độc Đáo, Chất Liệu Mềm Mại Thoáng Mát",https://tiki.vn/product-p127050110.html?spid=273309057,499000,499000,499000,4.0,1,https://salt.tikicdn.com/cache/280x280/ts/product/ca/32/1a/7ee7ca7fe71e740738d5deaeb46788e8.jpg,available,"['Xanh vàng', 'Đen vàng']","['2XL', '3XL', 'L', 'XL']",Nam,Quần short
52124302,2460302138470,Quần short Nam tập GYM thể thao ôm body - Q0002,https://tiki.vn/product-p52124302.html?spid=52124310,110000,110000,110000,4.3,12,https://salt.tikicdn.com/cache/280x280/ts/product/31/7c/86/3909e3d1ed9e77e98221820e93e042dd.jpg,available,"['Xanh dương', 'Xanh quân đội', 'Đen']","['2XL', 'L', 'XL']",Nam,Quần short
276831778,9159277835927,"Quần Short Nam Davie Dvs02 Chất Liệu Kate Thoáng Mát, Có 2 Túi Và Dây Rút",https://tiki.vn/product-p276831778.html?spid=276831780,98000,98000,98000,0.0,0,https://salt.tikicdn.com/cache/280x280/ts/product/9f/8a/e2/b53ae9f22d01f426528a3e04c7904935.jpg,available,"['1 cái (ngẫu nhiên)', '2 QUẦN', '3 cái (ngẫu nhiên)']",[],Nam,Quần short
100369140,2858308825523, Quần đùi ngắn nam Fasvin R21448.HN vải gió chun mềm mại co giãn thoải mái vận động,https://tiki.vn/product-p100369140.html?spid=100369604,129000,159000,159000,4.0,6,https://salt.tikicdn.com/cache/280x280/ts/product/cd/52/98/0f7a8c426cb526005b6646e5c6c08637.jpg,available,"['Ghi đậm', 'Tím than', 'Xanh', 'Đỏ']","['Size 3', 'Size 4', 'Size 5']",Nam,Quần short
274824907,5943723983684,Quần short nam ROUTINE ống rộng. Form Loose - 10S24PSH004 | LASTORE MENSWEAR,https://tiki.vn/product-p274824907.html?spid=274824911,449000,449000,449000,0.0,0,https://salt.tikicdn.com/cache/280x280/ts/product/81/54/e0/d647a388af3c07f1ef9c2cd537de071b.png,available,"['30', '31', '32']",[],Nam,Quần short
247447754,9765294129073,Quần Short Nam Kaki Vải Mềm Mịn Lưng Thun Có Dây Chun Kéo Co Giãn Cao Cấp PSQKN26,https://tiki.vn/product-p247447754.html?spid=274418316,139000,139000,139000,4.3,4,https://salt.tikicdn.com/cache/280x280/ts/product/b5/f0/0b/1e21211b123831539658e410eac7c171.jpg,available,['Màu Ngẫu Nhiên'],"['Size 28  (Từ 45 - 50kg)', 'Size 29  (Từ 51 - 55kg)', 'Size 30  ( Từ 56- 60kg)', 'Size 31  (Từ 61 - 65kg)', 'Size 32  (Từ 66 - 70kg)', 'Size 34  (Từ 71 - 78kg) ']",Nam,Quần short
113643997,5019128879034,"QUẦN ĐÙI NAM CATRIO MÀU 26 cho các bé lớn, nam trung niên, cao tuổi có cân nặng từ 40kg đến 83kg là quần short nam bé trai size đại, được làm từ vải may áo sơ mi thuộc BST quần short áo phông mùa hè CATRIO 2021",https://tiki.vn/product-p113643997.html?spid=113643999,44000,44000,44000,0.0,0,https://salt.tikicdn.com/cache/280x280/ts/product/4d/ff/7c/70f47976d9f6a9ed0af17f64ee5f0682.jpg,available,['MÀU 26'],"['SIZE L (56KG 65KG)', 'SIZE M (46KG-55KG)', 'SIZE XL(66KG-83KG)']",Nam,Quần short
113644068,2456202435923,"QUẦN ĐÙI NAM CATRIO MÀU 27 cho các bé lớn, nam trung niên, cao tuổi có cân nặng từ 40kg đến 83kg là quần short nam bé trai size đại, được làm từ vải may áo sơ mi thuộc BST quần short áo phông mùa hè CATRIO 2021",https://tiki.vn/product-p113644068.html?spid=113644070,44000,44000,44000,0.0,0,https://salt.tikicdn.com/cache/280x280/ts/product/52/41/4d/dc12a8b92e031e3a8f891e164bcb2128.jpg,available,['MÀU 27'],"['SIZE L (56KG 65KG)', 'SIZE M (46KG-55KG)', 'SIZE XL(66KG-83KG)']",Nam,Quần short
273397196,6181406490836,Viettien - Quần short nam kaki màu xanh đen 6P8167-6P8169,https://tiki.vn/product-p273397196.html?spid=273397206,425000,425000,425000,0.0,0,https://salt.tikicdn.com/cache/280x280/ts/product/7f/46/9e/d856764f44f5115c26000fafef1ebe05.jpg,available,['Regular'],['31'],Nam,Quần short
150880176,4863873640667,Viettien - Quần short nam kaki màu xanh đen đậm 6Q8038 regular,https://tiki.vn/product-p150880176.html?spid=150880182,495000,495000,495000,5.0,2,https://salt.tikicdn.com/cache/280x280/ts/product/18/a5/19/ace4094d39aa04c8c7e532c8fa1deb3c.jpg,available,['xanh đen đậm'],['31'],Nam,Quần short
276135114,7627706780492,Quần short nam ROUTINE màu Xanh đen và màu Beige. Form Straight - 10F24PSH036 | LASTORE MENSWEAR,https://tiki.vn/product-p276135114.html?spid=276135116,449000,449000,449000,0.0,0,https://salt.tikicdn.com/cache/280x280/ts/product/81/44/ff/bdaf054067cba5a9c961240e79a6ac59.png,available,"['BLACK', 'Beige', 'Navy']","['29', '30', '31', '32', '34']",Nam,Quần short
150879043,4830720464152,Viettien - Quần short nam kaki màu xanh đen 6Q8003 regular fit,https://tiki.vn/product-p150879043.html?spid=150879124,525000,525000,525000,5.0,2,https://salt.tikicdn.com/cache/280x280/ts/product/c1/78/63/f5d3eb23f437ae067603b9ce25fecc75.jpg,available,['XANH ĐEN'],['34'],Nam,Quần short
273787884,6709800905461,Quần short nam Khatoco (tặng vớ Khatoco cao cấp),https://tiki.vn/product-p273787884.html?spid=273787898,398000,398000,398000,0.0,0,https://salt.tikicdn.com/cache/280x280/ts/product/92/83/69/1c4f3901c551b96e036d235fe57ac30a.jpg,available,"['34', '35', '37', '38']","['Kem', 'MÀU XÁM', 'NÂU']",Nam,Quần short
275568511,6824809576417,Quần Short Nam ROUTINE lưng thun Rút Dây Trơn Có Túi Sau Form Relax - 10S24PSH029R1 | LASTORE MENSWEAR,https://tiki.vn/product-p275568511.html?spid=275568513,449000,449000,449000,0.0,0,https://salt.tikicdn.com/cache/280x280/ts/product/69/92/7b/a41dd63678b4097e516ec35fa8d49845.jpg,available,"['BLACK', 'PUMICE STONE']","['29', '30', '31', '32', '34']",Nam,Quần short
274835043,6731747567828,Quần Short Nam ROUTINE Ống Rộng Rút Dây Trơn Form Relax - 10F23PSH024 | LASTORE MENSWEAR,https://tiki.vn/product-p274835043.html?spid=274835051,449000,449000,449000,0.0,0,https://salt.tikicdn.com/cache/280x280/ts/product/a5/e1/2a/b02810d3da042f379f7c46a09b42f501.jpg,available,['BEIGE'],['31'],Nam,Quần short
